{
  "placement_plan_id": "pp-mock-001",
  "profile_id": "profile.reasoning.serve",
  "profile_digest": "sha256:1111111111111111111111111111111111111111111111111111111111111111",
  "policy_decision_ref": "policy:mock-001",
  "zones_evaluated": [
    {"zone_id": "zone-a", "eligible": true},
    {"zone_id": "zone-b", "eligible": false, "reason_code": "ARTIFACT_INCOMPATIBLE"}
  ],
  "state": "APPLIED",
  "deployment_ref": "deployment:mock-001",
  "submitted_at": "2026-09-27T00:00:00Z",
  "finished_at": "2026-09-27T00:05:00Z"
}
